{
  "findingId": "FIND-211",
  "dimension": "structural_integrity",
  "category": "code_structure",
  "severity": "high",
  "description": "`writable<AppShellState>(\"Loading\", (set) => { set(\"Loading\"); return () => { set(\"Loading\"); }; })` means: every time the subscriber count goes from 0 → 1, the store is forced to `\"Loading\"`, and every time it goes from 1 → 0 it is also forced to `\"Loading\"`. This is purely a test-hack workaround for cross-test pollution, but it leaks into production semantics:\n\n1. In a real Svelte app, when `AppShell.svelte` mounts and is the first subscriber, the store is reset to `\"Loading\"` even if a previous module-level write had set it to `\"Configured\"` (e.g. through HMR carryover).\n2. If transient unsubscribe events occur (component teardown), the store snaps back to `\"Loading\"` regardless of the actual application state.\n3. REQ-020 requires `'Loading' → 'Loading'` transitions to be **suppressed** by `bootAttempted`. The start/stop callbacks bypass that contract entirely — they unconditionally set `Loading` without consulting any flag.\n4. REQ-021's \"writes must originate from the 2 svelte components\" is violated: writes also originate from inside `appShellStore.ts` itself (the start/stop callbacks).\n\nProduction code should not be shaped by test isolation needs. The right fix is per-test module isolation (`vi.resetModules()`), not a global reset on subscribe.",
  "evidence": {
    "filePath": "promptnotes/src/lib/ui/app-shell/appShellStore.ts",
    "lineRange": "28-35"
  },
  "routeToPhase": "2c"
}
